<?xml version='1.0' encoding='UTF-8'?>
<auxiliarySetap xmlns:xsi="http://www.w3.org/2001/XMLSchema-instance" schemaVersion="1.5" xsi:noNamespaceSchemaLocation="../support/s1-aux-itc.xsd">
  <instrumentTimingCalibrationList count="56">
    <instrumentTimingCalibration>
      <swath>S1</swath>
      <polarisation>HH</polarisation>
      <rangeCalibration>6.4566e-11</rangeCalibration>
      <azimuthCalibration>-4.9701e-05</azimuthCalibration>
    </instrumentTimingCalibration>
    <instrumentTimingCalibration>
      <swath>S1</swath>
      <polarisation>HV</polarisation>
      <rangeCalibration>6.4566e-11</rangeCalibration>
      <azimuthCalibration>-4.9701e-05</azimuthCalibration>
    </instrumentTimingCalibration>
    <instrumentTimingCalibration>
      <swath>S1</swath>
      <polarisation>VV</polarisation>
      <rangeCalibration>6.4566e-11</rangeCalibration>
      <azimuthCalibration>-4.9701e-05</azimuthCalibration>
    </instrumentTimingCalibration>
    <instrumentTimingCalibration>
      <swath>S1</swath>
      <polarisation>VH</polarisation>
      <rangeCalibration>6.4566e-11</rangeCalibration>
      <azimuthCalibration>-4.9701e-05</azimuthCalibration>
    </instrumentTimingCalibration>
    <instrumentTimingCalibration>
      <swath>S2</swath>
      <polarisation>HH</polarisation>
      <rangeCalibration>6.4566e-11</rangeCalibration>
      <azimuthCalibration>-4.9701e-05</azimuthCalibration>
    </instrumentTimingCalibration>
    <instrumentTimingCalibration>
      <swath>S2</swath>
      <polarisation>HV</polarisation>
      <rangeCalibration>6.4566e-11</rangeCalibration>
      <azimuthCalibration>-4.9701e-05</azimuthCalibration>
    </instrumentTimingCalibration>
    <instrumentTimingCalibration>
      <swath>S2</swath>
      <polarisation>VV</polarisation>
      <rangeCalibration>6.4566e-11</rangeCalibration>
      <azimuthCalibration>-4.9701e-05</azimuthCalibration>
    </instrumentTimingCalibration>
    <instrumentTimingCalibration>
      <swath>S2</swath>
      <polarisation>VH</polarisation>
      <rangeCalibration>6.4566e-11</rangeCalibration>
      <azimuthCalibration>-4.9701e-05</azimuthCalibration>
    </instrumentTimingCalibration>
    <instrumentTimingCalibration>
      <swath>S3</swath>
      <polarisation>HH</polarisation>
      <rangeCalibration>6.4566e-11</rangeCalibration>
      <azimuthCalibration>-4.9701e-05</azimuthCalibration>
    </instrumentTimingCalibration>
    <instrumentTimingCalibration>
      <swath>S3</swath>
      <polarisation>HV</polarisation>
      <rangeCalibration>6.4566e-11</rangeCalibration>
      <azimuthCalibration>-4.9701e-05</azimuthCalibration>
    </instrumentTimingCalibration>
    <instrumentTimingCalibration>
      <swath>S3</swath>
      <polarisation>VV</polarisation>
      <rangeCalibration>6.4566e-11</rangeCalibration>
      <azimuthCalibration>-4.9701e-05</azimuthCalibration>
    </instrumentTimingCalibration>
    <instrumentTimingCalibration>
      <swath>S3</swath>
      <polarisation>VH</polarisation>
      <rangeCalibration>6.4566e-11</rangeCalibration>
      <azimuthCalibration>-4.9701e-05</azimuthCalibration>
    </instrumentTimingCalibration>
    <instrumentTimingCalibration>
      <swath>S4</swath>
      <polarisation>HH</polarisation>
      <rangeCalibration>6.4566e-11</rangeCalibration>
      <azimuthCalibration>-4.9701e-05</azimuthCalibration>
    </instrumentTimingCalibration>
    <instrumentTimingCalibration>
      <swath>S4</swath>
      <polarisation>HV</polarisation>
      <rangeCalibration>6.4566e-11</rangeCalibration>
      <azimuthCalibration>-4.9701e-05</azimuthCalibration>
    </instrumentTimingCalibration>
    <instrumentTimingCalibration>
      <swath>S4</swath>
      <polarisation>VV</polarisation>
      <rangeCalibration>6.4566e-11</rangeCalibration>
      <azimuthCalibration>-4.9701e-05</azimuthCalibration>
    </instrumentTimingCalibration>
    <instrumentTimingCalibration>
      <swath>S4</swath>
      <polarisation>VH</polarisation>
      <rangeCalibration>6.4566e-11</rangeCalibration>
      <azimuthCalibration>-4.9701e-05</azimuthCalibration>
    </instrumentTimingCalibration>
    <instrumentTimingCalibration>
      <swath>S5</swath>
      <polarisation>HH</polarisation>
      <rangeCalibration>6.4566e-11</rangeCalibration>
      <azimuthCalibration>-4.9701e-05</azimuthCalibration>
    </instrumentTimingCalibration>
    <instrumentTimingCalibration>
      <swath>S5</swath>
      <polarisation>HV</polarisation>
      <rangeCalibration>6.4566e-11</rangeCalibration>
      <azimuthCalibration>-4.9701e-05</azimuthCalibration>
    </instrumentTimingCalibration>
    <instrumentTimingCalibration>
      <swath>S5</swath>
      <polarisation>VV</polarisation>
      <rangeCalibration>6.4566e-11</rangeCalibration>
      <azimuthCalibration>-4.9701e-05</azimuthCalibration>
    </instrumentTimingCalibration>
    <instrumentTimingCalibration>
      <swath>S5</swath>
      <polarisation>VH</polarisation>
      <rangeCalibration>6.4566e-11</rangeCalibration>
      <azimuthCalibration>-4.9701e-05</azimuthCalibration>
    </instrumentTimingCalibration>
    <instrumentTimingCalibration>
      <swath>S6</swath>
      <polarisation>HH</polarisation>
      <rangeCalibration>6.4566e-11</rangeCalibration>
      <azimuthCalibration>-4.9701e-05</azimuthCalibration>
    </instrumentTimingCalibration>
    <instrumentTimingCalibration>
      <swath>S6</swath>
      <polarisation>HV</polarisation>
      <rangeCalibration>6.4566e-11</rangeCalibration>
      <azimuthCalibration>-4.9701e-05</azimuthCalibration>
    </instrumentTimingCalibration>
    <instrumentTimingCalibration>
      <swath>S6</swath>
      <polarisation>VV</polarisation>
      <rangeCalibration>6.4566e-11</rangeCalibration>
      <azimuthCalibration>-4.9701e-05</azimuthCalibration>
    </instrumentTimingCalibration>
    <instrumentTimingCalibration>
      <swath>S6</swath>
      <polarisation>VH</polarisation>
      <rangeCalibration>6.4566e-11</rangeCalibration>
      <azimuthCalibration>-4.9701e-05</azimuthCalibration>
    </instrumentTimingCalibration>
    <instrumentTimingCalibration>
      <swath>IW1</swath>
      <polarisation>HH</polarisation>
      <rangeCalibration>6.4566e-11</rangeCalibration>
      <azimuthCalibration>-4.9701e-05</azimuthCalibration>
    </instrumentTimingCalibration>
    <instrumentTimingCalibration>
      <swath>IW1</swath>
      <polarisation>HV</polarisation>
      <rangeCalibration>6.4566e-11</rangeCalibration>
      <azimuthCalibration>-4.9701e-05</azimuthCalibration>
    </instrumentTimingCalibration>
    <instrumentTimingCalibration>
      <swath>IW1</swath>
      <polarisation>VV</polarisation>
      <rangeCalibration>6.4566e-11</rangeCalibration>
      <azimuthCalibration>-4.9701e-05</azimuthCalibration>
    </instrumentTimingCalibration>
    <instrumentTimingCalibration>
      <swath>IW1</swath>
      <polarisation>VH</polarisation>
      <rangeCalibration>6.4566e-11</rangeCalibration>
      <azimuthCalibration>-4.9701e-05</azimuthCalibration>
    </instrumentTimingCalibration>
    <instrumentTimingCalibration>
      <swath>IW2</swath>
      <polarisation>HH</polarisation>
      <rangeCalibration>6.4566e-11</rangeCalibration>
      <azimuthCalibration>-4.9701e-05</azimuthCalibration>
    </instrumentTimingCalibration>
    <instrumentTimingCalibration>
      <swath>IW2</swath>
      <polarisation>HV</polarisation>
      <rangeCalibration>6.4566e-11</rangeCalibration>
      <azimuthCalibration>-4.9701e-05</azimuthCalibration>
    </instrumentTimingCalibration>
    <instrumentTimingCalibration>
      <swath>IW2</swath>
      <polarisation>VV</polarisation>
      <rangeCalibration>6.4566e-11</rangeCalibration>
      <azimuthCalibration>-4.9701e-05</azimuthCalibration>
    </instrumentTimingCalibration>
    <instrumentTimingCalibration>
      <swath>IW2</swath>
      <polarisation>VH</polarisation>
      <rangeCalibration>6.4566e-11</rangeCalibration>
      <azimuthCalibration>-4.9701e-05</azimuthCalibration>
    </instrumentTimingCalibration>
    <instrumentTimingCalibration>
      <swath>IW3</swath>
      <polarisation>HH</polarisation>
      <rangeCalibration>6.4566e-11</rangeCalibration>
      <azimuthCalibration>-4.9701e-05</azimuthCalibration>
    </instrumentTimingCalibration>
    <instrumentTimingCalibration>
      <swath>IW3</swath>
      <polarisation>HV</polarisation>
      <rangeCalibration>6.4566e-11</rangeCalibration>
      <azimuthCalibration>-4.9701e-05</azimuthCalibration>
    </instrumentTimingCalibration>
    <instrumentTimingCalibration>
      <swath>IW3</swath>
      <polarisation>VV</polarisation>
      <rangeCalibration>6.4566e-11</rangeCalibration>
      <azimuthCalibration>-4.9701e-05</azimuthCalibration>
    </instrumentTimingCalibration>
    <instrumentTimingCalibration>
      <swath>IW3</swath>
      <polarisation>VH</polarisation>
      <rangeCalibration>6.4566e-11</rangeCalibration>
      <azimuthCalibration>-4.9701e-05</azimuthCalibration>
    </instrumentTimingCalibration>
    <instrumentTimingCalibration>
      <swath>EW1</swath>
      <polarisation>HH</polarisation>
      <rangeCalibration>6.4566e-11</rangeCalibration>
      <azimuthCalibration>-4.9701e-05</azimuthCalibration>
    </instrumentTimingCalibration>
    <instrumentTimingCalibration>
      <swath>EW1</swath>
      <polarisation>HV</polarisation>
      <rangeCalibration>6.4566e-11</rangeCalibration>
      <azimuthCalibration>-4.9701e-05</azimuthCalibration>
    </instrumentTimingCalibration>
    <instrumentTimingCalibration>
      <swath>EW1</swath>
      <polarisation>VV</polarisation>
      <rangeCalibration>6.4566e-11</rangeCalibration>
      <azimuthCalibration>-4.9701e-05</azimuthCalibration>
    </instrumentTimingCalibration>
    <instrumentTimingCalibration>
      <swath>EW1</swath>
      <polarisation>VH</polarisation>
      <rangeCalibration>6.4566e-11</rangeCalibration>
      <azimuthCalibration>-4.9701e-05</azimuthCalibration>